primary_id,parent_id,type,subreddit,url,datetime,username,text_raw,text_clean,thematic_notes,final_theme,Search Entry,cluster
c015-17,p015,comment,r/EngineeringStudents,https://www.reddit.com/r/EngineeringStudents/comments/1c192f0/what_music_helps_you_study_and_focus/,2024-04-11,MirchalChef,Pure tone binaural beats are great for study and focus. Check MIRCHAL CHEF SOUND WORKS in youtube,pure tone binaural beats are great for study and focus check mirchal chef sound works in youtube,,,focus music,6
c015-18,p015,comment,r/EngineeringStudents,https://www.reddit.com/r/EngineeringStudents/comments/1c192f0/what_music_helps_you_study_and_focus/,2024-04-11,GonzoElTaco,"I've been using Mr.SuicideSheep's playlist on YouTube. He has a couple of +1 hour cyberpunk synth wave music. I'll throw that on and have a playlist of his three volumes so I don't mess with it much.

For me, I can't read or study very well with music with lyrics. So, I go for music that doesn't have it and put them on repeat.",i ve been using mr suicidesheep s playlist on youtube he has a couple of hour cyberpunk synth wave music i ll throw that on and have a playlist of his three volumes so i don t mess with it much for me i can t read or study very well with music with lyrics so i go for music that doesn t have it and put them on repeat,,,focus music,6
c015-19,p015,comment,r/EngineeringStudents,https://www.reddit.com/r/EngineeringStudents/comments/1c192f0/what_music_helps_you_study_and_focus/,2024-04-11,iron-niffler,"Video game/movie soundtracks; Zelda, Hollow Knight, Ori and some of the Iron Man ""lab scene"" tracks",video game movie soundtracks zelda hollow knight ori and some of the iron man lab scene tracks,,,focus music,7
c015-20,p015,comment,r/EngineeringStudents,https://www.reddit.com/r/EngineeringStudents/comments/1c192f0/what_music_helps_you_study_and_focus/,2024-04-11,123Eurydice,I have one playlist that I’ve listened to so many times it no longer registers as anything. It’s mostly pop and I can sing along without any brain power and it makes studying more fun.,i have one playlist that i ve listened to so many times it no longer registers as anything it s mostly pop and i can sing along without any brain power and it makes studying more fun,,,focus music,1
c015-21,p015,comment,r/EngineeringStudents,https://www.reddit.com/r/EngineeringStudents/comments/1c192f0/what_music_helps_you_study_and_focus/,2024-04-11,Such-Travel-3759,"Brain wave, I know it is fake science, but I feel good reading the promising title and feel calm and concentrated.",brain wave i know it is fake science but i feel good reading the promising title and feel calm and concentrated,,,focus music,6
c015-22,p015,comment,r/EngineeringStudents,https://www.reddit.com/r/EngineeringStudents/comments/1c192f0/what_music_helps_you_study_and_focus/,2024-04-11,ThyEpicGamer,"Look up macroblank. His covers are sic, the music is a dark jungley jazz vibe and really gets me jnto the flow state no matter what im doing.
",look up macroblank his covers are sic the music is a dark jungley jazz vibe and really gets me jnto the flow state no matter what im doing,,,focus music,1
c015-23,p015,comment,r/EngineeringStudents,https://www.reddit.com/r/EngineeringStudents/comments/1c192f0/what_music_helps_you_study_and_focus/,2024-04-11,deleted user,"Honestly, Mario Kart wii music. Gaming music, in general, is good for studying because it's designed to help people go through tasks and adventures. Halo music is also good for this.",honestly mario kart wii music gaming music in general is good for studying because it s designed to help people go through tasks and adventures halo music is also good for this,,,focus music,2
c015-24,p015,comment,r/EngineeringStudents,https://www.reddit.com/r/EngineeringStudents/comments/1c192f0/what_music_helps_you_study_and_focus/,2024-04-11,thelonliestcrowd,Look up Lofi girl on YouTube. They have a 24/7 playlist that got me through college.,look up lofi girl on youtube they have a playlist that got me through college,,,focus music,5
c015-25,p015,comment,r/EngineeringStudents,https://www.reddit.com/r/EngineeringStudents/comments/1c192f0/what_music_helps_you_study_and_focus/,2024-04-11,_Jazzles_,I like to listen to this one guy called Kalaman. His stuff is chill electronic with some ethic vibes. I use Spotify so i often listen to the Kalaman radio to get similar artists.,i like to listen to this one guy called kalaman his stuff is chill electronic with some ethic vibes i use spotify so i often listen to the kalaman radio to get similar artists,,,focus music,6
c015-26,p015,comment,r/EngineeringStudents,https://www.reddit.com/r/EngineeringStudents/comments/1c192f0/what_music_helps_you_study_and_focus/,2024-04-11,Realistic_Clerk_9324,House dance live sets,house dance live sets,,,focus music,1
c015-27,p015,comment,r/EngineeringStudents,https://www.reddit.com/r/EngineeringStudents/comments/1c192f0/what_music_helps_you_study_and_focus/,2024-04-11,rfag57,Classical string music for sure,classical string music for sure,,,focus music,2
c015-28,p015,comment,r/EngineeringStudents,https://www.reddit.com/r/EngineeringStudents/comments/1c192f0/what_music_helps_you_study_and_focus/,2024-04-11,ConfusedAce21,The Mario Kart Wii soundtrack worked for me,the mario kart wii soundtrack worked for me,,,focus music,1
c015-29,p015,comment,r/EngineeringStudents,https://www.reddit.com/r/EngineeringStudents/comments/1c192f0/what_music_helps_you_study_and_focus/,2024-04-11,Jeff10w25,jpop/jrock or classical music,jpop jrock or classical music,,,focus music,2
c015-30,p015,comment,r/EngineeringStudents,https://www.reddit.com/r/EngineeringStudents/comments/1c192f0/what_music_helps_you_study_and_focus/,2024-04-11,Alvinshotju1cebox,"Dreamhop, Lofi Vibes, and Lofi Girl are my go to Youtube channels for studying. I agree with others here to go with something non-lyrical.

The Stardew Valley OST also slaps.",dreamhop lofi vibes and lofi girl are my go to youtube channels for studying i agree with others here to go with something non lyrical the stardew valley ost also slaps,,,focus music,5
c015-31,p015,comment,r/EngineeringStudents,https://www.reddit.com/r/EngineeringStudents/comments/1c192f0/what_music_helps_you_study_and_focus/,2024-04-11,Rak3nnus,Ambient and 90s hip hop. I do generally like 90s hip hop but there is rarely a moment where I rather listen to old hip hop than new trap and hip hop. Besides when I’m studying/working. MF DOOM and DMX make me crazy productive. I get into a really good flow this way.,ambient and s hip hop i do generally like s hip hop but there is rarely a moment where i rather listen to old hip hop than new trap and hip hop besides when i m studying working mf doom and dmx make me crazy productive i get into a really good flow this way,,,focus music,3
c015-32,p015,comment,r/EngineeringStudents,https://www.reddit.com/r/EngineeringStudents/comments/1c192f0/what_music_helps_you_study_and_focus/,2024-04-11,OoglieBooglie93,I went balls to the wall with speedcore and hardcore techno when I needed to crank out a bunch of drawings in a week at work.,i went balls to the wall with speedcore and hardcore techno when i needed to crank out a bunch of drawings in a week at work,,,focus music,1
c015-33,p015,comment,r/EngineeringStudents,https://www.reddit.com/r/EngineeringStudents/comments/1c192f0/what_music_helps_you_study_and_focus/,2024-04-12,Low-Complex-5168,It’s jungle dnb or break core music for me. Always has been + lofi,it s jungle dnb or break core music for me always has been lofi,,,focus music,5
c015-34,p015,comment,r/EngineeringStudents,https://www.reddit.com/r/EngineeringStudents/comments/1c192f0/what_music_helps_you_study_and_focus/,2024-04-12,deleted user,"Very light music when I'm starting out or need motivation

If I'm cramming or on a tight deadline, I'll occasionally play a certain song I like on repeat. Half the time, I just turn it off completely for the last hour of my study. 

Music almost feels like drugs sometimes for working (I've never done drugs lol) so I don't rely on it.",very light music when i m starting out or need motivation if i m cramming or on a tight deadline i ll occasionally play a certain song i like on repeat half the time i just turn it off completely for the last hour of my study music almost feels like drugs sometimes for working i ve never done drugs lol so i don t rely on it,,,focus music,6
c015-35,p015,comment,r/EngineeringStudents,https://www.reddit.com/r/EngineeringStudents/comments/1c192f0/what_music_helps_you_study_and_focus/,2024-04-12,exurl,"Playlist 1: Minecraft soundtrack (minus the weird ones)

Playlist 2: coconut mall and infinite realm of incomprehensible suffering",playlist minecraft soundtrack minus the weird ones playlist coconut mall and infinite realm of incomprehensible suffering,,,focus music,1
c015-36,p015,comment,r/EngineeringStudents,https://www.reddit.com/r/EngineeringStudents/comments/1c192f0/what_music_helps_you_study_and_focus/,2024-04-12,Ghosteen_18,"I study with classical when im trying to understand concepts, i just attach the concept flow to the Melody.
When i understood the concept and just trying to drill exercises i blast the nightclub EDM",i study with classical when im trying to understand concepts i just attach the concept flow to the melody when i understood the concept and just trying to drill exercises i blast the nightclub edm,,,focus music,0
c015-37,p015,comment,r/EngineeringStudents,https://www.reddit.com/r/EngineeringStudents/comments/1c192f0/what_music_helps_you_study_and_focus/,2024-04-12,JustKozi,Doom soundtrack or lofi no in between,doom soundtrack or lofi no in between,,,focus music,5
c015-38,p015,comment,r/EngineeringStudents,https://www.reddit.com/r/EngineeringStudents/comments/1c192f0/what_music_helps_you_study_and_focus/,2024-04-12,deleted user,"Whatever is in my playlist. Just today i listened Nina Simone-I'm feeling good, Frank Sinatra-That's life and some random NCS-ass song on repeat for hours while i was doing my homework.

Sometimes i'd get genuinely overwhelmed and mute the music until i'm done or until i get bored again. Some other times i can't put full focus on what i'm doing unless i got some music on so as to isolate myself from the rest of the world for a moment.",whatever is in my playlist just today i listened nina simone i m feeling good frank sinatra that s life and some random ncs ass song on repeat for hours while i was doing my homework sometimes i d get genuinely overwhelmed and mute the music until i m done or until i get bored again some other times i can t put full focus on what i m doing unless i got some music on so as to isolate myself from the rest of the world for a moment,,,focus music,0
c015-39,p015,comment,r/EngineeringStudents,https://www.reddit.com/r/EngineeringStudents/comments/1c192f0/what_music_helps_you_study_and_focus/,2024-04-12,Physical-Light-9471,"Dean Martin’s Italian love songs album, Al Green’s greatest hits, Living Colour’s Stain, White Stripes De Stijl, or Strokes Is this it. Depends on what DEFCON I’m on.",dean martin s italian love songs album al green s greatest hits living colour s stain white stripes de stijl or strokes is this it depends on what defcon i m on,,,focus music,1
c015-40,p015,comment,r/EngineeringStudents,https://www.reddit.com/r/EngineeringStudents/comments/1c192f0/what_music_helps_you_study_and_focus/,2024-04-12,InsurmountableMind,"If there is music on, I just start to pay attention to all the details in the song and lose all my focus on the study subject. White noise, rain preferred.",if there is music on i just start to pay attention to all the details in the song and lose all my focus on the study subject white noise rain preferred,,,focus music,6
c015-41,p015,comment,r/EngineeringStudents,https://www.reddit.com/r/EngineeringStudents/comments/1c192f0/what_music_helps_you_study_and_focus/,2024-04-12,Snoo-46809,Usually boss fight music osts. Or combat. Since they usually elevate my heartbeat or intense classical music. I really can't with chill/relax music since they slow me down and I study slow because of it,usually boss fight music osts or combat since they usually elevate my heartbeat or intense classical music i really can t with chill relax music since they slow me down and i study slow because of it,,,focus music,6
c015-42,p015,comment,r/EngineeringStudents,https://www.reddit.com/r/EngineeringStudents/comments/1c192f0/what_music_helps_you_study_and_focus/,2024-04-12,CarbonBasedLifeForm6,If I'm studying I mostly listen to Epic Rap Battles Of History or Chill Carti remixes on repeat. By studying I mean just practicing problems not reading,if i m studying i mostly listen to epic rap battles of history or chill carti remixes on repeat by studying i mean just practicing problems not reading,,,focus music,6
c015-43,p015,comment,r/EngineeringStudents,https://www.reddit.com/r/EngineeringStudents/comments/1c192f0/what_music_helps_you_study_and_focus/,2024-04-12,GuitarDean2294,"this might sound a little strange, but I tried listening to the muzak instrumentals that are played at the WTC plaza, and it actually helped me focus and ended up getting a good review done",this might sound a little strange but i tried listening to the muzak instrumentals that are played at the wtc plaza and it actually helped me focus and ended up getting a good review done,,,focus music,6
p016,p016,post,r/ADHD,https://www.reddit.com/r/ADHD/comments/1hygpbp/for_those_of_you_who_listen_to_music_to_help_you/,2025-01-10,iametron,"For those of you who listen to music to help you focus
Questions/Advice
What do you listen to that isn’t over-bearing? With / without lyrics? Low volume? Any specific artists or genres that work best for you?

Loud and with lyrics is usually hard for me so I find myself putting on some Lofi lounge / chill beats on Digitally Imported. Calms the mind and keeps the motivation going. However, on occasion some really good uplifting drum n bass is good if I need to kickstart my brain and tap into more speed without the ping ponging effect.

Certain sounds are distracting or irritating. Very sensitive to sounds in voices or instruments. Classical or literally anything from Pearl Jam is like ear torture even when not trying to be productive.

Curious what others listen to that helps?",for those of you who listen to music to help you focus questions advice what do you listen to that isn t over bearing with without lyrics low volume any specific artists or genres that work best for you loud and with lyrics is usually hard for me so i find myself putting on some lofi lounge chill beats on digitally imported calms the mind and keeps the motivation going however on occasion some really good uplifting drum n bass is good if i need to kickstart my brain and tap into more speed without the ping ponging effect certain sounds are distracting or irritating very sensitive to sounds in voices or instruments classical or literally anything from pearl jam is like ear torture even when not trying to be productive curious what others listen to that helps,,,focus music,6
c016-01,p016,comment,r/ADHD,https://www.reddit.com/r/ADHD/comments/1hygpbp/for_those_of_you_who_listen_to_music_to_help_you/,2025-01-10,TriflePrestigious885,"Binaural beats when I need to think and process.

Metal or EDM for working through repetitive or tedious tasks and production style work.

Instrumental soundtracks, classical music, bluegrass, classic rock, and a variety of other stuff for just about anything else or when I’m just in the mood for something different.

I do find that listening to music in other languages helps prevent getting distracted by lyrics when I’m craving a certain genre or style.",binaural beats when i need to think and process metal or edm for working through repetitive or tedious tasks and production style work instrumental soundtracks classical music bluegrass classic rock and a variety of other stuff for just about anything else or when i m just in the mood for something different i do find that listening to music in other languages helps prevent getting distracted by lyrics when i m craving a certain genre or style,,,focus music,4
c016-02,p016,comment,r/ADHD,https://www.reddit.com/r/ADHD/comments/1hygpbp/for_those_of_you_who_listen_to_music_to_help_you/,2025-01-10,United_Entrepreneur6,I can only listen to brown noise playlists to focus lol everything else is just too distracting for me unfortunately,i can only listen to brown noise playlists to focus lol everything else is just too distracting for me unfortunately,,,focus music,6
c016-03,p016,comment,r/ADHD,https://www.reddit.com/r/ADHD/comments/1hygpbp/for_those_of_you_who_listen_to_music_to_help_you/,2025-01-10,BIRD_II,"Video game soundtracks or classical music (Debussy and bach are my favourites), both function well as background noise, especially because in the case of most video game music it's made specifically to be background noise.",video game soundtracks or classical music debussy and bach are my favourites both function well as background noise especially because in the case of most video game music it s made specifically to be background noise,,,focus music,4
c016-04,p016,comment,r/ADHD,https://www.reddit.com/r/ADHD/comments/1hygpbp/for_those_of_you_who_listen_to_music_to_help_you/,2025-01-10,choosingishard-,"Anime soundtracks, relaxing ones rather than loud j-pop style ones",anime soundtracks relaxing ones rather than loud j pop style ones,,,focus music,1
c016-05,p016,comment,r/ADHD,https://www.reddit.com/r/ADHD/comments/1hygpbp/for_those_of_you_who_listen_to_music_to_help_you/,2025-01-10,hipnotron,"I need it loud and intese... goth metal, doom, and powermetal and others metals works for me. And I need to learn the lyrics, wich I need to read to do it so because of adhd",i need it loud and intese goth metal doom and powermetal and others metals works for me and i need to learn the lyrics wich i need to read to do it so because of adhd,,,focus music,6
c016-06,p016,comment,r/ADHD,https://www.reddit.com/r/ADHD/comments/1hygpbp/for_those_of_you_who_listen_to_music_to_help_you/,2025-01-10,soccerandsoap,Brown noise! I even find white noise too strong,brown noise i even find white noise too strong,,,focus music,1
c016-07,p016,comment,r/ADHD,https://www.reddit.com/r/ADHD/comments/1hygpbp/for_those_of_you_who_listen_to_music_to_help_you/,2025-01-10,DescriptionLost8940,Emo music or lo-fi beats. The former for anything that doesn't involve writing or reading,emo music or lo fi beats the former for anything that doesn t involve writing or reading,,,focus music,4
c016-08,p016,comment,r/ADHD,https://www.reddit.com/r/ADHD/comments/1hygpbp/for_those_of_you_who_listen_to_music_to_help_you/,2025-01-11,sarcastic_chad62,"For study concentration i listen to video game music along with other instrumental/classical music. Sometimes i just put on a single song and play it on loop throughout the task. When i am doing tasks which do not require much concentration, such as bathing, working out or cooking i just put on any of my fav playlists and i like to sing along it.

I need music for everything practically. Cant survive without it",for study concentration i listen to video game music along with other instrumental classical music sometimes i just put on a single song and play it on loop throughout the task when i am doing tasks which do not require much concentration such as bathing working out or cooking i just put on any of my fav playlists and i like to sing along it i need music for everything practically cant survive without it,,,focus music,6
c016-09,p016,comment,r/ADHD,https://www.reddit.com/r/ADHD/comments/1hygpbp/for_those_of_you_who_listen_to_music_to_help_you/,2025-01-11,Daisydoo1432,"Jared Benjamin. also def depends on mood and what I’m trying to accomplish. My adhd boys have requested Deadmau5 to sleep, and I have fallen asleep right along with them to that repetitive beat.",jared benjamin also def depends on mood and what i m trying to accomplish my adhd boys have requested deadmau to sleep and i have fallen asleep right along with them to that repetitive beat,,,focus music,1
c016-10,p016,comment,r/ADHD,https://www.reddit.com/r/ADHD/comments/1hygpbp/for_those_of_you_who_listen_to_music_to_help_you/,2025-01-11,Primary_Ad1798,60s-70s music helps me concentrate. I love CCR & The Doors.,s s music helps me concentrate i love ccr the doors,,,focus music,4
c016-11,p016,comment,r/ADHD,https://www.reddit.com/r/ADHD/comments/1hygpbp/for_those_of_you_who_listen_to_music_to_help_you/,2025-01-11,BackgroundDisaster90,"Honestly it depends on the mood that I’m in. I’ll listen to a variety of things, including a top 40 playlist, classical music, lofi music, and albums of artists I enjoy (like Kendrick Lamar, Chappell Roan, Green Day, Weird Al, and various musical recordings). If I listen to a specific artist or album, it has to be an album that’s familiar to me - if it’s a new album, I’ll focus on the album rather than the work.",honestly it depends on the mood that i m in i ll listen to a variety of things including a top playlist classical music lofi music and albums of artists i enjoy like kendrick lamar chappell roan green day weird al and various musical recordings if i listen to a specific artist or album it has to be an album that s familiar to me if it s a new album i ll focus on the album rather than the work,,,focus music,1
c016-12,p016,comment,r/ADHD,https://www.reddit.com/r/ADHD/comments/1hygpbp/for_those_of_you_who_listen_to_music_to_help_you/,2025-01-11,Rumorly,"Depends on what I’m doing. If I’m cleaning, playing a game, like Minecraft or Stardew Valley, or anything where I don’t have to pay super close attention, I like loud music I can sing along to (the specific type depends on what my current music hyper-focus is).

But if I’m reading, I’ll listen to video game soundtracks. My main for this is the Dragon Age soundtracks. (Which also means that the theme music for all the fantasy romance books I read is from Dragon Age)",depends on what i m doing if i m cleaning playing a game like minecraft or stardew valley or anything where i don t have to pay super close attention i like loud music i can sing along to the specific type depends on what my current music hyper focus is but if i m reading i ll listen to video game soundtracks my main for this is the dragon age soundtracks which also means that the theme music for all the fantasy romance books i read is from dragon age,,,focus music,7
c016-13,p016,comment,r/ADHD,https://www.reddit.com/r/ADHD/comments/1hygpbp/for_those_of_you_who_listen_to_music_to_help_you/,2025-01-11,airysunshine,"Tbh most music as long as there’s something playing. A lot of songs without lyrics or anything slow or acoustic makes me feel sad or restless. Lofi is nice when I’m exhausted and trying to sleep- I like glitchxcity.

Any of my favorite songs/my main playlist is my go-to lol, and honestly if it’s outside of my regular playlist I’ll end up focusing on “what’s gonna come on next?” And not what I’m supposed to be doing.

But I can’t focus if there’s silence.",tbh most music as long as there s something playing a lot of songs without lyrics or anything slow or acoustic makes me feel sad or restless lofi is nice when i m exhausted and trying to sleep i like glitchxcity any of my favorite songs my main playlist is my go to lol and honestly if it s outside of my regular playlist i ll end up focusing on what s gonna come on next and not what i m supposed to be doing but i can t focus if there s silence,,,focus music,2
c016-14,p016,comment,r/ADHD,https://www.reddit.com/r/ADHD/comments/1hygpbp/for_those_of_you_who_listen_to_music_to_help_you/,2025-01-11,tinycarspreferred,"I gotta mix it up. This week a Medieval playlist. Classic jazz is generally good. I’ve found pop is fine - but easier to focus in languages other than my own. So I can’t tune in to the lyrics. Japanese 60s/70s pop, French/Algerian (my Mom used to play Enrico Macias growing up; stumbled on album Deb by Souad Massi). Russian accordion. Sometimes I’ll type in a country into Spotify and grab from a genre I’m feeling that day.

Alternate option: British gardening podcasts on BBC iplayer I have zero interest in gardening/plants but it’s kinda pleasant having them chat calmly in the background while I work. And it’s not the news.",i gotta mix it up this week a medieval playlist classic jazz is generally good i ve found pop is fine but easier to focus in languages other than my own so i can t tune in to the lyrics japanese s s pop french algerian my mom used to play enrico macias growing up stumbled on album deb by souad massi russian accordion sometimes i ll type in a country into spotify and grab from a genre i m feeling that day alternate option british gardening podcasts on bbc iplayer i have zero interest in gardening plants but it s kinda pleasant having them chat calmly in the background while i work and it s not the news,,,focus music,1
c016-15,p016,comment,r/ADHD,https://www.reddit.com/r/ADHD/comments/1hygpbp/for_those_of_you_who_listen_to_music_to_help_you/,2025-01-11,deleted user,"Pop punk! I do sing along either in my head or out loud but it doesn’t get in the way I think, it’s a distraction but it’s like a constant low level sort of distraction I think that helps me get on with ignoring or not looking for other distractions. Listening to Spotify DJ atm.",pop punk i do sing along either in my head or out loud but it doesn t get in the way i think it s a distraction but it s like a constant low level sort of distraction i think that helps me get on with ignoring or not looking for other distractions listening to spotify dj atm,,,focus music,1
