primary_id,parent_id,type,subreddit,url,datetime,username,text_raw,text_clean,thematic_notes,final_theme,Search Entry,cluster
c016-16,p016,comment,r/ADHD,https://www.reddit.com/r/ADHD/comments/1hygpbp/for_those_of_you_who_listen_to_music_to_help_you/,2025-01-11,Mcanneg,I love instrumental cover songs of popular music. My brain pays a little attention to try to guess the song or hum along but it’s not too distracting because there aren’t lyrics.,i love instrumental cover songs of popular music my brain pays a little attention to try to guess the song or hum along but it s not too distracting because there aren t lyrics,,,focus music,6
c016-17,p016,comment,r/ADHD,https://www.reddit.com/r/ADHD/comments/1hygpbp/for_those_of_you_who_listen_to_music_to_help_you/,2025-01-11,AnuNimasa,Jazz?,jazz,,,focus music,1
c016-18,p016,comment,r/ADHD,https://www.reddit.com/r/ADHD/comments/1hygpbp/for_those_of_you_who_listen_to_music_to_help_you/,2025-01-11,TumbleWeed75,Anything with a good beat that drowns out people noises.,anything with a good beat that drowns out people noises,,,focus music,1
c016-19,p016,comment,r/ADHD,https://www.reddit.com/r/ADHD/comments/1hygpbp/for_those_of_you_who_listen_to_music_to_help_you/,2025-01-11,AttentionTrue4660,Usually jazz or bossa nova,usually jazz or bossa nova,,,focus music,1
c016-20,p016,comment,r/ADHD,https://www.reddit.com/r/ADHD/comments/1hygpbp/for_those_of_you_who_listen_to_music_to_help_you/,2025-01-11,blockbusterbabe,"My need for background music expanded my music taste. I don’t speak either language but I love folky/classical Arabic and Spanish music. Listening to music in a different language helps me not focus too much on the song (because I don’t understand) and just enjoy it in the background.

On the flip side: this is a great exercise to keep your brain sharp and your worldview open!",my need for background music expanded my music taste i don t speak either language but i love folky classical arabic and spanish music listening to music in a different language helps me not focus too much on the song because i don t understand and just enjoy it in the background on the flip side this is a great exercise to keep your brain sharp and your worldview open,,,focus music,4
c016-21,p016,comment,r/ADHD,https://www.reddit.com/r/ADHD/comments/1hygpbp/for_those_of_you_who_listen_to_music_to_help_you/,2025-01-11,Late_Source8838,"Brown, pink, or white noise for days when I need to write or when focusing is really difficult. Usually just loud enough to hear. In less stressful days, but when I still need to get things done, I listen to Joe Satriani and related guitar-heavy instrumentals (whatever the algorithm brings). I like Americana when I’m just trying to exist and muddle through regular tasks.",brown pink or white noise for days when i need to write or when focusing is really difficult usually just loud enough to hear in less stressful days but when i still need to get things done i listen to joe satriani and related guitar heavy instrumentals whatever the algorithm brings i like americana when i m just trying to exist and muddle through regular tasks,,,focus music,0
c016-22,p016,comment,r/ADHD,https://www.reddit.com/r/ADHD/comments/1hygpbp/for_those_of_you_who_listen_to_music_to_help_you/,2025-01-11,Swordfish_Trombonist,Deep house,deep house,,,focus music,4
c016-23,p016,comment,r/ADHD,https://www.reddit.com/r/ADHD/comments/1hygpbp/for_those_of_you_who_listen_to_music_to_help_you/,2025-01-11,YpsitheFlintsider,"EDM songs, or normal hip hop/rock/whatever that I have years of tolerance of.",edm songs or normal hip hop rock whatever that i have years of tolerance of,,,focus music,7
c016-24,p016,comment,r/ADHD,https://www.reddit.com/r/ADHD/comments/1hygpbp/for_those_of_you_who_listen_to_music_to_help_you/,2025-01-11,brizzy500,"Somewhere between meditation and ambient music. When I need to focus, it needs to be slow and spacey.",somewhere between meditation and ambient music when i need to focus it needs to be slow and spacey,,,focus music,4
c016-25,p016,comment,r/ADHD,https://www.reddit.com/r/ADHD/comments/1hygpbp/for_those_of_you_who_listen_to_music_to_help_you/,2025-01-11,Defiant_Cantaloupe26,"Personally, modern classical/neoclassical/new age/I suck at naming genres. Soundtracks. Scott Buckley and Clint Mansell are favorites. Olafur Arnalds, Sigur Ros.

Other stuff, don't know what to call it. Post rock?

Hauschka, Audiomachine, One Hundred Years",personally modern classical neoclassical new age i suck at naming genres soundtracks scott buckley and clint mansell are favorites olafur arnalds sigur ros other stuff don t know what to call it post rock hauschka audiomachine one hundred years,,,focus music,7
c016-26,p016,comment,r/ADHD,https://www.reddit.com/r/ADHD/comments/1hygpbp/for_those_of_you_who_listen_to_music_to_help_you/,2025-01-11,Difficult_Standard_1,"90s techno, IDM, Glitch through my headphones….",s techno idm glitch through my headphones,,,focus music,1
c016-27,p016,comment,r/ADHD,https://www.reddit.com/r/ADHD/comments/1hygpbp/for_those_of_you_who_listen_to_music_to_help_you/,2025-01-11,ReyoRedwolf,"i like Boards of Canada. chill electronic, not too stimulating or distracting if i need to do focus but enough so i can listen and get something done.",i like boards of canada chill electronic not too stimulating or distracting if i need to do focus but enough so i can listen and get something done,,,focus music,6
c016-28,p016,comment,r/ADHD,https://www.reddit.com/r/ADHD/comments/1hygpbp/for_those_of_you_who_listen_to_music_to_help_you/,2025-01-11,a-chameleon-builds,I listen to a range of stuff. Buy generally strong neural effect music is what get's me into high gear focus.,i listen to a range of stuff buy generally strong neural effect music is what get s me into high gear focus,,,focus music,6
p017,p017,post,r/Productivity,https://www.reddit.com/r/productivity/comments/1olmjex/what_music_to_listen_for_workdeep_focus/,2025-11-01,Gigifigixd,"What music to listen for work/deep focus?
Question
I think the tittle says it all, but just in case I need music so I can focus on my work so there is not silence all the time. Thanks in advance!",what music to listen for work deep focus question i think the tittle says it all but just in case i need music so i can focus on my work so there is not silence all the time thanks in advance,,,focus music,4
c017-01,p017,comment,r/Productivity,https://www.reddit.com/r/productivity/comments/1olmjex/what_music_to_listen_for_workdeep_focus/,2025-11-01,3yl,"For me, it's heavy metal",for me it s heavy metal,,,focus music,1
c017-02,p017,comment,r/Productivity,https://www.reddit.com/r/productivity/comments/1olmjex/what_music_to_listen_for_workdeep_focus/,2025-11-01,ImmortalDawn666,For me melodic death and black metal,for me melodic death and black metal,,,focus music,1
c017-03,p017,comment,r/Productivity,https://www.reddit.com/r/productivity/comments/1olmjex/what_music_to_listen_for_workdeep_focus/,2025-11-01,jametent,Endel,endel,,,focus music,1
c017-04,p017,comment,r/Productivity,https://www.reddit.com/r/productivity/comments/1olmjex/what_music_to_listen_for_workdeep_focus/,2025-11-01,jtt36175,brain.fm,brain fm,,,focus music,6
c017-05,p017,comment,r/Productivity,https://www.reddit.com/r/productivity/comments/1olmjex/what_music_to_listen_for_workdeep_focus/,2025-11-01,Jimu_Monk9525,I’ve pleasantly enjoyed listening to Cozy Hogwarts Ambience on Spotify.,i ve pleasantly enjoyed listening to cozy hogwarts ambience on spotify,,,focus music,1
c017-06,p017,comment,r/Productivity,https://www.reddit.com/r/productivity/comments/1olmjex/what_music_to_listen_for_workdeep_focus/,2025-11-01,volticizer,I personally listen to synthwave but without lyrics. I get really in the zone and it makes me energetic and excited to get shit done.,i personally listen to synthwave but without lyrics i get really in the zone and it makes me energetic and excited to get shit done,,,focus music,3
c017-07,p017,comment,r/Productivity,https://www.reddit.com/r/productivity/comments/1olmjex/what_music_to_listen_for_workdeep_focus/,2025-11-01,No-Airport-1234,"I can’t read or concentrate listening to music with lyrics. So, for me, it’s Classic or Lo-Fi.",i can t read or concentrate listening to music with lyrics so for me it s classic or lo fi,,,focus music,4
c017-08,p017,comment,r/Productivity,https://www.reddit.com/r/productivity/comments/1olmjex/what_music_to_listen_for_workdeep_focus/,2025-11-01,Aware-Fix9964,"For me is no sudden drums, 40hz beats, calming and meditative.",for me is no sudden drums hz beats calming and meditative,,,focus music,4
c017-09,p017,comment,r/Productivity,https://www.reddit.com/r/productivity/comments/1olmjex/what_music_to_listen_for_workdeep_focus/,2025-11-01,ChatGodPT,Classical music. Tried after I heard that’s what Elon always played. Mozart and Bach.,classical music tried after i heard that s what elon always played mozart and bach,,,focus music,2
c017-10,p017,comment,r/Productivity,https://www.reddit.com/r/productivity/comments/1olmjex/what_music_to_listen_for_workdeep_focus/,2025-11-01,Top-Recording2333,I listen lofi from youtube,i listen lofi from youtube,,,focus music,5
c017-11,p017,comment,r/Productivity,https://www.reddit.com/r/productivity/comments/1olmjex/what_music_to_listen_for_workdeep_focus/,2025-11-01,Semi-Nerdy,"Video game music is meant to draw you in and focus. I enjoy Jeremy Soule (Skyrim) radio on Pandora, and add some Mass Effect. Movie Soundtracks work well too. A little Howard Shore (LOTR) or John Williams (Superman/Star Wars/Jurassic) or Max Richter (Leftovers) and of course Hans Zimmer (Interstellar, Galdiator)",video game music is meant to draw you in and focus i enjoy jeremy soule skyrim radio on pandora and add some mass effect movie soundtracks work well too a little howard shore lotr or john williams superman star wars jurassic or max richter leftovers and of course hans zimmer interstellar galdiator,,,focus music,4
c017-12,p017,comment,r/Productivity,https://www.reddit.com/r/productivity/comments/1olmjex/what_music_to_listen_for_workdeep_focus/,2025-11-01,Cool_Recording9401,Binaural 40 Hz beats as recommended by Dr. Huberman. ,binaural hz beats as recommended by dr huberman,,,focus music,6
c017-13,p017,comment,r/Productivity,https://www.reddit.com/r/productivity/comments/1olmjex/what_music_to_listen_for_workdeep_focus/,2025-11-01,okyeah93,Cafe jazz,cafe jazz,,,focus music,1
c017-14,p017,comment,r/Productivity,https://www.reddit.com/r/productivity/comments/1olmjex/what_music_to_listen_for_workdeep_focus/,2025-11-01,dinky_beans,liquid drum & bass,liquid drum bass,,,focus music,1
c017-15,p017,comment,r/Productivity,https://www.reddit.com/r/productivity/comments/1olmjex/what_music_to_listen_for_workdeep_focus/,2025-11-01,floatinbrain,I listen to lofi or ambient,i listen to lofi or ambient,,,focus music,5
c017-16,p017,comment,r/Productivity,https://www.reddit.com/r/productivity/comments/1olmjex/what_music_to_listen_for_workdeep_focus/,2025-11-01,Most_Depth709,"
It depends on personal preference. As a person with ADHD, I personally would recommend/choose the soundtracks of series and movies.

My reasoning:

You have repeating patterns that are not always directly repeating, but similar enough not to be too distracting. You have a strong core that gives you ""a tact to work with"" but has no songtext, so you don't accidentally sing and disrupt others. It gives enough stimulation to not feel outside of the world, but enough repetition so you feel cozy.

Additionally, it's similar enough to classical music to have (at least for me and some others) similar effects. - but for the assumed facts (the studies aren't fool-proof), I don't put my hand into the fire.",it depends on personal preference as a person with adhd i personally would recommend choose the soundtracks of series and movies my reasoning you have repeating patterns that are not always directly repeating but similar enough not to be too distracting you have a strong core that gives you a tact to work with but has no songtext so you don t accidentally sing and disrupt others it gives enough stimulation to not feel outside of the world but enough repetition so you feel cozy additionally it s similar enough to classical music to have at least for me and some others similar effects but for the assumed facts the studies aren t fool proof i don t put my hand into the fire,,,focus music,7
c017-17,p017,comment,r/Productivity,https://www.reddit.com/r/productivity/comments/1olmjex/what_music_to_listen_for_workdeep_focus/,2025-11-01,ChecklistAnimations,Orchestral Metal or Cyber Metal for me. I get my best work done during those times. I feel if the lyrics are not understandable at first listen I can just focus on getting work done.,orchestral metal or cyber metal for me i get my best work done during those times i feel if the lyrics are not understandable at first listen i can just focus on getting work done,,,focus music,4
c017-18,p017,comment,r/Productivity,https://www.reddit.com/r/productivity/comments/1olmjex/what_music_to_listen_for_workdeep_focus/,2025-11-01,Infamous_State_7127,endel has been incredible for me,endel has been incredible for me,,,focus music,1
c017-19,p017,comment,r/Productivity,https://www.reddit.com/r/productivity/comments/1olmjex/what_music_to_listen_for_workdeep_focus/,2025-11-01,repderp,Lord of the rings soundtrack ambience for me.,lord of the rings soundtrack ambience for me,,,focus music,1
c017-20,p017,comment,r/Productivity,https://www.reddit.com/r/productivity/comments/1olmjex/what_music_to_listen_for_workdeep_focus/,2025-11-01,Maittanee,"Any LoFi works for me.

I dont like the total silence, because then I hear every little step from my neighbors and be distracted. I cannot work with the white/brown/any color noise thing. I need music in the background which does not distract me. Neither nice sax solo or any text or even any nice piano play.
The typical LoFi-Girl on twitch/YouTube/YouTube Music helps me a lot.",any lofi works for me i dont like the total silence because then i hear every little step from my neighbors and be distracted i cannot work with the white brown any color noise thing i need music in the background which does not distract me neither nice sax solo or any text or even any nice piano play the typical lofi girl on twitch youtube youtube music helps me a lot,,,focus music,5
c017-21,p017,comment,r/Productivity,https://www.reddit.com/r/productivity/comments/1olmjex/what_music_to_listen_for_workdeep_focus/,2025-11-01,Glowing102,Biaaural bears for focus... Just type it into Spotify It's like magic!,biaaural bears for focus just type it into spotify it s like magic,,,focus music,1
c017-22,p017,comment,r/Productivity,https://www.reddit.com/r/productivity/comments/1olmjex/what_music_to_listen_for_workdeep_focus/,2025-11-01,no_one_66,Synthwave without lyrics,synthwave without lyrics,,,focus music,1
c017-23,p017,comment,r/Productivity,https://www.reddit.com/r/productivity/comments/1olmjex/what_music_to_listen_for_workdeep_focus/,2025-11-01,Goby99,Classical Guitar when I'm doing my lawyer stuff.,classical guitar when i m doing my lawyer stuff,,,focus music,7
c017-24,p017,comment,r/Productivity,https://www.reddit.com/r/productivity/comments/1olmjex/what_music_to_listen_for_workdeep_focus/,2025-11-02,NoSubstance6387,"For work I can’t listen to anything with a beat, but discovered I can really concentrate listening to ambient music. My favourite is Brian Eno’s ‘Music for Installations’",for work i can t listen to anything with a beat but discovered i can really concentrate listening to ambient music my favourite is brian eno s music for installations,,,focus music,3
c017-25,p017,comment,r/Productivity,https://www.reddit.com/r/productivity/comments/1olmjex/what_music_to_listen_for_workdeep_focus/,2025-11-02,Consistent_War_6891,Kenny G,kenny g,,,focus music,1
c017-26,p017,comment,r/Productivity,https://www.reddit.com/r/productivity/comments/1olmjex/what_music_to_listen_for_workdeep_focus/,2025-11-02,Rat_Girl69,"Endel also, but I am so burnt out at the moment from too many assignments/adhd/end of year that I’ve been working in bed with a tv show or movie in the background. It’s a comfort thing I think",endel also but i am so burnt out at the moment from too many assignments adhd end of year that i ve been working in bed with a tv show or movie in the background it s a comfort thing i think,,,focus music,0
c017-27,p017,comment,r/Productivity,https://www.reddit.com/r/productivity/comments/1olmjex/what_music_to_listen_for_workdeep_focus/,2025-11-02,Aebro99,Brown noise,brown noise,,,focus music,1
c017-28,p017,comment,r/Productivity,https://www.reddit.com/r/productivity/comments/1olmjex/what_music_to_listen_for_workdeep_focus/,2025-11-03,matthew_e_p,Try binaural beats over music if you want to have something over silence though don’t want the distraction of music. There are few apps,try binaural beats over music if you want to have something over silence though don t want the distraction of music there are few apps,,,focus music,6
c017-29,p017,comment,r/Productivity,https://www.reddit.com/r/productivity/comments/1olmjex/what_music_to_listen_for_workdeep_focus/,2025-11-05,Ok-Presentation296,Anime OST’s. Locks you right in.,anime ost s locks you right in,,,focus music,1
c017-30,p017,comment,r/Productivity,https://www.reddit.com/r/productivity/comments/1olmjex/what_music_to_listen_for_workdeep_focus/,2025-11-05,hughdavin,I think lofi is genre made for it,i think lofi is genre made for it,,,focus music,5
