primary_id,parent_id,type,subreddit,url,datetime,username,text_raw,text_clean,thematic_notes,final_theme,Search Entry,cluster
P001,P001,post,r/Headspace,https://www.reddit.com/r/Headspace/comments/1ouhw3t/focus_playlists_aluna/,2025-10-01,GirlGodd,"Focus Music Aluna Playlist
I canceled my subscription because i barely use the app (realize i prefer unguided meditations and all the extra stuff in the app takes forever to load sometimes) but looking for a way to listen to the focus music.

Love the Aluna Playlist in particular. Please if anyone knows where to find it on the web as a downloadable file",focus music aluna playlist i canceled my subscription because i barely use the app realize i prefer unguided meditations and all the extra stuff in the app takes forever to load sometimes but looking for a way to listen to the focus music love the aluna playlist in particular please if anyone knows where to find it on the web as a downloadable file,,,r/Headspace: focus playlist,2
P002,P002,post,r/Headspace,https://www.reddit.com/r/Headspace/comments/puqeqq/focus_musicplaylist_reccommendations/,2021-09-24,pizzzacones,"Focus music/playlist reccommendations
I've found Headspace's productivity/focus tip of listening to specific music for specific tasks really helpful.

However, I've found myself stuck on listening to Steady Stream or Breakthrough. I haven't found new ones I like by just testing them out randomly.

If you like the two above, do you have any other favorite music tracks or artist playlists? General recommendations work as well!",focus music playlist reccommendations i ve found headspace s productivity focus tip of listening to specific music for specific tasks really helpful however i ve found myself stuck on listening to steady stream or breakthrough i haven t found new ones i like by just testing them out randomly if you like the two above do you have any other favorite music tracks or artist playlists general recommendations work as well,,,r/Headspace: focus playlist,2
C002-01,P002,comment,r/Headspace,https://www.reddit.com/r/Headspace/comments/puqeqq/focus_musicplaylist_reccommendations/,2021-09-25,AdJunior7755,The one I listen to the most is the one from Shane Lindstrom.,the one i listen to the most is the one from shane lindstrom,,,r/Headspace: focus playlist,6
C002-02,P002,comment,r/Headspace,https://www.reddit.com/r/Headspace/comments/puqeqq/focus_musicplaylist_reccommendations/,2021-09-29,deleted user,Generally I really like electronic ambient stuff. Been listening to a lot of Brian Eno and also a friend of mine who makes super long ambient pieces on YouTube. https://youtube.com/channel/UCnjMTxSwjSkEzZ1XH82Y1nQ,generally i really like electronic ambient stuff been listening to a lot of brian eno and also a friend of mine who makes super long ambient pieces on youtube,,,r/Headspace: focus playlist,3
C002-03,P002,comment,r/Headspace,https://www.reddit.com/r/Headspace/comments/puqeqq/focus_musicplaylist_reccommendations/,2021-10-01,rasta-pasta12,I personally like soft and slow music to get me to focus,i personally like soft and slow music to get me to focus,,,r/Headspace: focus playlist,4
P003,P003,post,r/Headspace,https://www.reddit.com/r/Headspace/comments/ojiduv/focus_music/,2021-07-13,ExchangeOptimal,"Focus Music
How to make best out of Focus Music?
Is there any guide on how and when to effectively use Focus Music?",focus music how to make best out of focus music is there any guide on how and when to effectively use focus music,,,,2
C003-01,P003,comment,r/Headspace,https://www.reddit.com/r/Headspace/comments/ojiduv/focus_music/,2021-07-13,interactive-biscuit,I don’t think it’s that complicated. I just listen to it when I need to work. Fading Fog is my favorite. It does something to my brain. They’re all pretty good though.,i don t think it s that complicated i just listen to it when i need to work fading fog is my favorite it does something to my brain they re all pretty good though,,,r/Headspace: focus playlist,6
C003-02,P003,comment,r/Headspace,https://www.reddit.com/r/Headspace/comments/ojiduv/focus_music/,2021-07-16,pizzzacones,"I remember a tip they shared was to listen to different types of music with different sets of tasks so your brain starts to associate the music and focus together.

Like for times where I need to be creative, I have one playlist I always go back to but if it's more ""checking off tasks"", I have a separate playlist for that.",i remember a tip they shared was to listen to different types of music with different sets of tasks so your brain starts to associate the music and focus together like for times where i need to be creative i have one playlist i always go back to but if it s more checking off tasks i have a separate playlist for that,,,r/Headspace: focus playlist,4
C002-04,P002,comment,r/Headspace,https://www.reddit.com/r/Headspace/comments/puqeqq/focus_musicplaylist_reccommendations/,2021-10-26,abcbri,I listen to a podcast on Spotify called Focus Flow. It has built in Pomodoro breaks.,i listen to a podcast on spotify called focus flow it has built in pomodoro breaks,,,,1
P004,P004,post,r/Headspace,https://www.reddit.com/r/Headspace/comments/v7ojdw/steady_stream_focus_music/,2022-06-08,interactive-biscuit,"Steady Stream Focus Music
… gives me Stranger Things vibes. But also, great for focusing. I always start my workday with Focus Music. It’s my favorite part of Headspace.",steady stream focus music gives me stranger things vibes but also great for focusing i always start my workday with focus music it s my favorite part of headspace,,,r/Headspace: focus playlist,2
C004-01,P004,comment,r/Headspace,https://www.reddit.com/r/Headspace/comments/v7ojdw/steady_stream_focus_music/,2022-06-08,andisteezy,Focus music is my favorite! 2nd is sleep music!,focus music is my favorite nd is sleep music,,,r/Headspace: focus playlist,2
C004-02,P004,comment,r/Headspace,https://www.reddit.com/r/Headspace/comments/v7ojdw/steady_stream_focus_music/,2022-06-08,interactive-biscuit,Agree. Focus Music does something to my brain. The Sleep Music does too - I’m not someone who can easily nap but Doze? Well I’m nodding off to that!,agree focus music does something to my brain the sleep music does too i m not someone who can easily nap but doze well i m nodding off to that,,,r/Headspace: focus playlist,2
C004-03,P004,comment,r/Headspace,https://www.reddit.com/r/Headspace/comments/v7ojdw/steady_stream_focus_music/,2022-06-08,interactive-biscuit,"Do you have a favorite in the Focus category? I genuinely like them all, but my favorite is Fading Fog. That one is bizarre what it does to focus my mind!",do you have a favorite in the focus category i genuinely like them all but my favorite is fading fog that one is bizarre what it does to focus my mind,,,r/Headspace: focus playlist,2
C004-04,P004,comment,r/Headspace,https://www.reddit.com/r/Headspace/comments/v7ojdw/steady_stream_focus_music/,2022-06-09,andisteezy,"Oh wow that's tough. I love them all! Let me see... I have favorited nearly all of them, but I know some stand out more than others, for me:

Tina Guos Playlist

Star Power

Neon Drive

Steady Stream

Bounce Back

Making Space

Jazz Cat

Like Home",oh wow that s tough i love them all let me see i have favorited nearly all of them but i know some stand out more than others for me tina guos playlist star power neon drive steady stream bounce back making space jazz cat like home,,,r/Headspace: focus playlist,1
C004-05,P004,comment,r/Headspace,https://www.reddit.com/r/Headspace/comments/v7ojdw/steady_stream_focus_music/,2022-06-09,interactive-biscuit,"Wow yeah me too! Hard to pick. Off the top of my head I can say Neon Drive, Like Home, Jazz Cat stand out to me too! I also really like Deep Blue (I think this is the one that gets a little spooky) and Fading Fog which is hands down the best one for me to start the day with if I’m feeling foggy. It pulls me right out of it like magic. Really h haven’t had a bad experience with any of them and I think I’ve tried them all by now. So good.",wow yeah me too hard to pick off the top of my head i can say neon drive like home jazz cat stand out to me too i also really like deep blue i think this is the one that gets a little spooky and fading fog which is hands down the best one for me to start the day with if i m feeling foggy it pulls me right out of it like magic really h haven t had a bad experience with any of them and i think i ve tried them all by now so good,,,r/Headspace: focus playlist,1
C004-06,P004,comment,r/Headspace,https://www.reddit.com/r/Headspace/comments/v7ojdw/steady_stream_focus_music/,2022-06-09,andisteezy,"Yes I love Deep Blue! I'm going to give Fading Fog another go before my days end to see how it feels. It wasn't one I had previously favorited, but I like to revisit them all from time to time. Thank you for the suggestion!",yes i love deep blue i m going to give fading fog another go before my days end to see how it feels it wasn t one i had previously favorited but i like to revisit them all from time to time thank you for the suggestion,,,r/Headspace: focus playlist,4
P005,P005,post,r/Headspace,https://www.reddit.com/r/Headspace/comments/perj7x/focus_music_sebastian_tellier_playlist/,2021-08-30,interactive-biscuit,"Focus Music: Sebastian Tellier Playlist
If you like Twin Peaks, Grave of the Fireflies, and Peaky Blinders. Am I right?",focus music sebastian tellier playlist if you like twin peaks grave of the fireflies and peaky blinders am i right,,,r/Headspace: focus playlist,2
C005-01,P005,comment,r/Headspace,https://www.reddit.com/r/Headspace/comments/perj7x/focus_music_sebastian_tellier_playlist/,2022-09-28,refrigerador82,This focus music is the best! Perfect ambience.,this focus music is the best perfect ambience,,,r/Headspace: focus playlist,2
C005-02,P005,comment,r/Headspace,https://www.reddit.com/r/Headspace/comments/perj7x/focus_music_sebastian_tellier_playlist/,2022-09-28,interactive-biscuit,Completely agree. It’s like perfection. I try Apple Focus playlist and it’s also good but it’s not composed the same bizarrely good way the focus music is. It’s magical.,completely agree it s like perfection i try apple focus playlist and it s also good but it s not composed the same bizarrely good way the focus music is it s magical,,,r/Headspace: focus playlist,2
C005-03,P005,comment,r/Headspace,https://www.reddit.com/r/Headspace/comments/perj7x/focus_music_sebastian_tellier_playlist/,2022-09-29,interactive-biscuit,I think it was called Pure Focus. It’s a playlist they curate and add to weekly or so. It’s subpar compared to the Focus Music on Headspace though. You can find some of these on YouTube I think.,i think it was called pure focus it s a playlist they curate and add to weekly or so it s subpar compared to the focus music on headspace though you can find some of these on youtube i think,,,r/Headspace: focus playlist,2
P006,P006,post,r/Headspace,https://www.reddit.com/r/Headspace/comments/i85gdy/new_section_on_headspace_app_focus/,2020-08-12,wangbeatriz,"New section on headspace app: focus
I think that the new section is awesome and I am very excited to explore it a little bit more. I loved the idea of the playlists and I'm very happy with the update! :) I like the work from home part too. What did you guys think?",new section on headspace app focus i think that the new section is awesome and i am very excited to explore it a little bit more i loved the idea of the playlists and i m very happy with the update i like the work from home part too what did you guys think,,,r/Headspace: focus playlist,6
C006-01,P006,comment,r/Headspace,https://www.reddit.com/r/Headspace/comments/i85gdy/new_section_on_headspace_app_focus/,2020-08-12,GapLeap,"Oh, cool! I hadn’t noticed the Focus addition, but just went and looked. I’ll certainly make use of it. I usually listen to the Deep Focus playlist on Spotify when working, but it’s nice to have other options.",oh cool i hadn t noticed the focus addition but just went and looked i ll certainly make use of it i usually listen to the deep focus playlist on spotify when working but it s nice to have other options,,,r/Headspace: focus playlist,4
C006-02,P006,comment,r/Headspace,https://www.reddit.com/r/Headspace/comments/i85gdy/new_section_on_headspace_app_focus/,2020-08-12,wangbeatriz,I usually use Spotify too but today while working I used the focus John legend playlist and really liked it! Tomorrow I'll be trying the work from home meditations :) I'm happy they are adding stuff to headspace,i usually use spotify too but today while working i used the focus john legend playlist and really liked it tomorrow i ll be trying the work from home meditations i m happy they are adding stuff to headspace,,,r/Headspace: focus playlist,1
P007,P007,post,r/Headspace,https://www.reddit.com/r/Headspace/comments/otal7t/do_you_like_the_focus_music/,2021-07-28,deleted user,"Do you like the Focus Music?
I subscribed yesterday. I've been listening to ""Making Space"" for 25 minutes and I'm very impressed so far. It started louder than I expected, but past the 5-10 minute mark the music became a lot softer and rain was added in. So far it seems to be switching between different elements to avoid becoming repetitive.

With how good it seems to be working for me, I'm going to keep it a part of my work routine from now on. But I'm new and I'd love to hear more experienced users' thoughts on it! Do you like it? Does it work for you?",do you like the focus music i subscribed yesterday i ve been listening to making space for minutes and i m very impressed so far it started louder than i expected but past the minute mark the music became a lot softer and rain was added in so far it seems to be switching between different elements to avoid becoming repetitive with how good it seems to be working for me i m going to keep it a part of my work routine from now on but i m new and i d love to hear more experienced users thoughts on it do you like it does it work for you,,,r/Headspace: focus playlist,4
C007-01,P007,comment,r/Headspace,https://www.reddit.com/r/Headspace/comments/otal7t/do_you_like_the_focus_music/,2021-07-28,tumanow,Aluna's playlist is great.,aluna s playlist is great,,,r/Headspace: focus playlist,1
C007-02,P007,comment,r/Headspace,https://www.reddit.com/r/Headspace/comments/otal7t/do_you_like_the_focus_music/,2021-07-28,thissucks99,Day two for me here. I had the music going all day in my office. I work from home. It was amazing,day two for me here i had the music going all day in my office i work from home it was amazing,,,r/Headspace: focus playlist,1
C007-03,P007,comment,r/Headspace,https://www.reddit.com/r/Headspace/comments/otal7t/do_you_like_the_focus_music/,2021-07-28,interactive-biscuit,"I’m really into it. I think the person behind the music is John Legend, but I could be wrong. Anyway , the entire collection is great.

My favorite to start the day is Fading Fog.

I also really like Sebastian Teller’s playlist and Kindness’ playlist, but they’re all exceptionally good, in my opinion. They each have their own effect. It’s honestly so hard to pick favorites.

These playlists are really incredible to me. They’re not generally what I would consider “good sounding music”, but I feel like they’re scientifically composed to affect your brain waves. That’s how it feels to me anyway. There is nothing else quite like it out there and I’m a huge, huge fan.",i m really into it i think the person behind the music is john legend but i could be wrong anyway the entire collection is great my favorite to start the day is fading fog i also really like sebastian teller s playlist and kindness playlist but they re all exceptionally good in my opinion they each have their own effect it s honestly so hard to pick favorites these playlists are really incredible to me they re not generally what i would consider good sounding music but i feel like they re scientifically composed to affect your brain waves that s how it feels to me anyway there is nothing else quite like it out there and i m a huge huge fan,,,r/Headspace: focus playlist,6
C007-04,P007,comment,r/Headspace,https://www.reddit.com/r/Headspace/comments/otal7t/do_you_like_the_focus_music/,2021-07-29,deleted user,"Yeah, I also think there's some research behind the way the music is composed. It feels too impactful to be just random tracks mixed together.

I've used many other focus apps who excessively boast about their superior technology (Endel, Brain.fm) but Headspace's tracks have been my favourite so far.",yeah i also think there s some research behind the way the music is composed it feels too impactful to be just random tracks mixed together i ve used many other focus apps who excessively boast about their superior technology endel brain fm but headspace s tracks have been my favourite so far,,,r/Headspace: focus playlist,0
C007-05,P007,comment,r/Headspace,https://www.reddit.com/r/Headspace/comments/otal7t/do_you_like_the_focus_music/,2021-08-03,livertoo2,There is one I love; I think it’s called cafe piano and hubub or something similar. It’s basically ambient restaurant sounds and is super comforting to me!,there is one i love i think it s called cafe piano and hubub or something similar it s basically ambient restaurant sounds and is super comforting to me,,,r/Headspace: focus playlist,3
C007-06,P007,comment,r/Headspace,https://www.reddit.com/r/Headspace/comments/otal7t/do_you_like_the_focus_music/,2021-08-03,deleted user,"Wow, that's exactly the type of stuff I love! Thanks for telling me. I've been trying out the artist-specific playlists since I posted this, and so far I love Tina Guo's the most",wow that s exactly the type of stuff i love thanks for telling me i ve been trying out the artist specific playlists since i posted this and so far i love tina guo s the most,,,r/Headspace: focus playlist,0
P008,P008,post,r/Headspace,https://www.reddit.com/r/Headspace/comments/p9x4k8/does_anyone_have_a_good_description_of_the_focus/,2021-08-23,bubbiestruggles,"does anyone have a good description of the focus music?
something that might be a little more in depth than what's already provided. if you want to describe the genre and vibes of your faves, that works too! I'm a huge fan of Zoom Out and Fading Fog, but I want to try some others but I'm not sure about many of the featured artists available and I've started some playlists based on the description, only to find myself not that charmed by it and ending up going back to another. I would absolutely love a good chiptune playlist... any suggestions? faves?",does anyone have a good description of the focus music something that might be a little more in depth than what s already provided if you want to describe the genre and vibes of your faves that works too i m a huge fan of zoom out and fading fog but i want to try some others but i m not sure about many of the featured artists available and i ve started some playlists based on the description only to find myself not that charmed by it and ending up going back to another i would absolutely love a good chiptune playlist any suggestions faves,,,r/Headspace: focus playlist,0
C008-01,P008,comment,r/Headspace,https://www.reddit.com/r/Headspace/comments/p9x4k8/does_anyone_have_a_good_description_of_the_focus/,2021-08-23,c_nd_n,"I like Hans Zimmer's playlist. Even before headspace, Hans Zimmer soundtracks on YT have been background music for my studies.",i like hans zimmer s playlist even before headspace hans zimmer soundtracks on yt have been background music for my studies,,,r/Headspace: focus playlist,0
P009,P009,post,r/Headspace,https://www.reddit.com/r/Headspace/comments/11jx90n/focus_music_jazz_cat_is_superb_similar/,2023-03-06,PARTYPOISON,"Focus Music: 'Jazz Cat' is superb. Similar recommendations, please?
I've really been enjoying the Focus music 'Jazz Cat' whilst studying, it's a pleasant chill vibe, but perky enough not to send me to sleep. I particularly enjoy the piano parts.

Can anyone recommend any similar jazzy music for me to try? Without vocals, please, as I can't listen to words and write coherently at the same time. Thankyou! :)",focus music jazz cat is superb similar recommendations please i ve really been enjoying the focus music jazz cat whilst studying it s a pleasant chill vibe but perky enough not to send me to sleep i particularly enjoy the piano parts can anyone recommend any similar jazzy music for me to try without vocals please as i can t listen to words and write coherently at the same time thankyou,,,r/Headspace: focus playlist,2
C009-01,P009,comment,r/Headspace,https://www.reddit.com/r/Headspace/comments/11jx90n/focus_music_jazz_cat_is_superb_similar/,2023-03-25,Manateepiglet,On Spotify you could try their playlists “Jazz Vibes” “Smooth Jazz Chill” or “Lazy Jazz Cat” or “Cozy Jazz Cat” Hope this helps!,on spotify you could try their playlists jazz vibes smooth jazz chill or lazy jazz cat or cozy jazz cat hope this helps,,,r/Headspace: focus playlist,1
P010,P010,post,r/Headspace,https://www.reddit.com/r/Headspace/comments/r4nr2m/3d_soundscapes_for_focus_are_too_fastpaced/,2021-11-29,SkyShake97,"3D Soundscapes for Focus are too fast-paced!
Does anyone else also feel that the 3D soundscapes for focus, especially the water and rain ones, are too fast-paced and loud? Like guys, if I want a waterfall sound to focus, I picture a clear, slow and sluggish stream somewhere deep in a jungle, not the Niagara falls! The water 'moves' way too fast and is an actual distraction for me. Similar nature sounds on YouTube are way better, IMO.",d soundscapes for focus are too fast paced does anyone else also feel that the d soundscapes for focus especially the water and rain ones are too fast paced and loud like guys if i want a waterfall sound to focus i picture a clear slow and sluggish stream somewhere deep in a jungle not the niagara falls the water moves way too fast and is an actual distraction for me similar nature sounds on youtube are way better imo,,,r/Headspace: focus,6
c010-01,p010,comment,r/Headspace,https://www.reddit.com/r/Headspace/comments/r4nr2m/3d_soundscapes_for_focus_are_too_fastpaced/,2021-11-29,interactive-biscuit,Haven’t tried these yet but I’ll check it out today. It’s interesting though because I feel like their focus music and nap soundscapes are the work of science. The way they affect my brain is almost magical. So well done. I’d be lying if I said it wasn’t my favorite parts of Headspace.,haven t tried these yet but i ll check it out today it s interesting though because i feel like their focus music and nap soundscapes are the work of science the way they affect my brain is almost magical so well done i d be lying if i said it wasn t my favorite parts of headspace,,,r/Headspace: focus,2
p011,p011,post,r/Headspace,https://www.reddit.com/r/Headspace/comments/qfjcix/what_soundscapes_would_you_like/,2021-10-25,No-Craft-6123,"What soundscapes would you like?
Hey everyone, do you guys have any soundscapes ideas that you would really like to see added? I just thought about it because I’m listening soundscapes while studying and noticed that I would love a cafe soundscape or something more urban than what we have in the app. Do you guys have more suggestions?",what soundscapes would you like hey everyone do you guys have any soundscapes ideas that you would really like to see added i just thought about it because i m listening soundscapes while studying and noticed that i would love a cafe soundscape or something more urban than what we have in the app do you guys have more suggestions,,,r/Headspace: soundscape,3
c011-01,p011,comment,r/Headspace,https://www.reddit.com/r/Headspace/comments/qfjcix/what_soundscapes_would_you_like/,2021-10-26,nvmls,"I loved the laundromat one except that the high pitched noise always wakes me up so I gave up after two nights. I would love to have a running dishwasher one, a sort of mechanical rhythmic motor/sloshing water sound. mynoise.net used to have a laundromat noise similar to this but I can't find it anymore.",i loved the laundromat one except that the high pitched noise always wakes me up so i gave up after two nights i would love to have a running dishwasher one a sort of mechanical rhythmic motor sloshing water sound mynoise net used to have a laundromat noise similar to this but i can t find it anymore,,,r/Headspace: soundscape,4
c011-02,p011,comment,r/Headspace,https://www.reddit.com/r/Headspace/comments/qfjcix/what_soundscapes_would_you_like/,2021-11-05,privlko,Owl's Forest but with more owls.,owl s forest but with more owls,,,r/Headspace: soundscape,1
c011-03,p011,comment,r/Headspace,https://www.reddit.com/r/Headspace/comments/qfjcix/what_soundscapes_would_you_like/,2022-01-08,UniqueCaregiver310,Something with faster running water like a waterfall.,something with faster running water like a waterfall,,,r/Headspace: soundscape,3
p012,p012,post,r/Productivity,https://www.reddit.com/r/productivity/comments/1pp6jse/what_kind_of_music_helps_you_get_into_deep_focus/,2025-12-17,Apart-Brilliant8482,"What kind of music helps you get into deep focus?
I’ve been experimenting with different background sounds for deep work and programming. Lo-fi works sometimes, but I personally focus better with minimal ambient music and no beats. I made a short focus mix that I’ve been testing during 2–3 hour work blocks. Would love to know what kind of music or sound you use to stay focused.",what kind of music helps you get into deep focus i ve been experimenting with different background sounds for deep work and programming lo fi works sometimes but i personally focus better with minimal ambient music and no beats i made a short focus mix that i ve been testing during hour work blocks would love to know what kind of music or sound you use to stay focused,,,Headspace Focus Music,4
