primary_id,parent_id,type,subreddit,url,datetime,username,text_raw,text_clean,thematic_notes,final_theme,Search Entry,cluster
c012-01,p012,comment,r/Productivity,https://www.reddit.com/r/productivity/comments/1pp6jse/what_kind_of_music_helps_you_get_into_deep_focus/,2025-12-17,UCharlotte19,"In my case, I concentrate better with very minimalist background music or constant sounds. I prefer something without rhythm or distinct melodies, because that way I don't get distracted and can stay focused for longer",in my case i concentrate better with very minimalist background music or constant sounds i prefer something without rhythm or distinct melodies because that way i don t get distracted and can stay focused for longer,,,Headspace Focus Music,4
c012-02,p012,comment,r/Productivity,https://www.reddit.com/r/productivity/comments/1pp6jse/what_kind_of_music_helps_you_get_into_deep_focus/,2025-12-17,EmbarrassedManager65,lofi,lofi,,,Headspace Focus Music,5
c012-03,p012,comment,r/Productivity,https://www.reddit.com/r/productivity/comments/1pp6jse/what_kind_of_music_helps_you_get_into_deep_focus/,2025-12-17,savage_shaq,Instrumentals. Polyphia is my favorite band and their music makes me lock in.,instrumentals polyphia is my favorite band and their music makes me lock in,,,Headspace Focus Music,2
c012-04,p012,comment,r/Productivity,https://www.reddit.com/r/productivity/comments/1pp6jse/what_kind_of_music_helps_you_get_into_deep_focus/,2025-12-17,bloodninja5,"i literally cannot focus with lyrics or vocals but i swear by those ""rainy day coffee shop ambience"" videos on youtube. something about that background chatter actually helps my brain stay on track.",i literally cannot focus with lyrics or vocals but i swear by those rainy day coffee shop ambience videos on youtube something about that background chatter actually helps my brain stay on track,,,Headspace Focus Music,4
c012-05,p012,comment,r/Productivity,https://www.reddit.com/r/productivity/comments/1pp6jse/what_kind_of_music_helps_you_get_into_deep_focus/,2025-12-17,glupingane,"It depends on my mood and type of task.

Usually the absolute best is pure silence, but that can be really hard to accomplish in practice. 

I can get real good progress with some sort of grand/epic movie instrumental music mixes if the mood is right. 

Other times, super catchy stuff hits right, or just calm beats, or even just brown noise is great. 

One thing in common though, is never vocals. Vocals break my focus immediately ",it depends on my mood and type of task usually the absolute best is pure silence but that can be really hard to accomplish in practice i can get real good progress with some sort of grand epic movie instrumental music mixes if the mood is right other times super catchy stuff hits right or just calm beats or even just brown noise is great one thing in common though is never vocals vocals break my focus immediately,,,Headspace Focus Music,0
c012-06,p012,comment,r/Productivity,https://www.reddit.com/r/productivity/comments/1pp6jse/what_kind_of_music_helps_you_get_into_deep_focus/,2025-12-17,HomeworkScary2919,"I completely agree with you. Vocals are very distracting. That's why I made a 12-hour loop without vocals, without any abrupt transitions. I even optimized it for different purposes. 4 hours of Deep Focus, 4 hours of LoFi, and another 4 hours of ambient and zen mixed together.",i completely agree with you vocals are very distracting that s why i made a hour loop without vocals without any abrupt transitions i even optimized it for different purposes hours of deep focus hours of lofi and another hours of ambient and zen mixed together,,,Headspace Focus Music,4
c012-07,p012,comment,r/Productivity,https://www.reddit.com/r/productivity/comments/1pp6jse/what_kind_of_music_helps_you_get_into_deep_focus/,2025-12-17,Silver-Refuse-8098,"Chillstep. Got a few 1-2 hour mixes I keep going back to.

Been using for over 10 years and still works best compared to anything new I’ve tried.",chillstep got a few hour mixes i keep going back to been using for over years and still works best compared to anything new i ve tried,,,Headspace Focus Music,7
c012-08,p012,comment,r/Productivity,https://www.reddit.com/r/productivity/comments/1pp6jse/what_kind_of_music_helps_you_get_into_deep_focus/,2025-12-17,kat924,Nature sounds,nature sounds,,,Headspace Focus Music,4
c012-09,p012,comment,r/Productivity,https://www.reddit.com/r/productivity/comments/1pp6jse/what_kind_of_music_helps_you_get_into_deep_focus/,2025-12-17,NLong89,Hans Zimmer,hans zimmer,,,Headspace Focus Music,1
c012-10,p012,comment,r/Productivity,https://www.reddit.com/r/productivity/comments/1pp6jse/what_kind_of_music_helps_you_get_into_deep_focus/,2025-12-17,Need2SchColonoscopy,Anything I enjoy I’ve listened to enough times it fades into the background.,anything i enjoy i ve listened to enough times it fades into the background,,,Headspace Focus Music,4
c012-11,p012,comment,r/Productivity,https://www.reddit.com/r/productivity/comments/1pp6jse/what_kind_of_music_helps_you_get_into_deep_focus/,2025-12-17,saolima,"Vivaldi - for creative purposes, shamanic drums - for finishing boring things, Chopin - for routine",vivaldi for creative purposes shamanic drums for finishing boring things chopin for routine,,,Headspace Focus Music,0
c012-12,p012,comment,r/Productivity,https://www.reddit.com/r/productivity/comments/1pp6jse/what_kind_of_music_helps_you_get_into_deep_focus/,2025-12-17,designingclarity,Brain fm or lofi and some functional fragrance gets me into the zone.,brain fm or lofi and some functional fragrance gets me into the zone,,,Headspace Focus Music,5
c012-13,p012,comment,r/Productivity,https://www.reddit.com/r/productivity/comments/1pp6jse/what_kind_of_music_helps_you_get_into_deep_focus/,2025-12-18,AdCoSa,lofi,lofi,,,Headspace Focus Music,5
c012-14,p012,comment,r/Productivity,https://www.reddit.com/r/productivity/comments/1pp6jse/what_kind_of_music_helps_you_get_into_deep_focus/,2025-12-18,LazyCrab8688,Silence - I like to have the door open for the birds and breeze in the trees. Music just distracts me,silence i like to have the door open for the birds and breeze in the trees music just distracts me,,,Headspace Focus Music,2
c012-15,p012,comment,r/Productivity,https://www.reddit.com/r/productivity/comments/1pp6jse/what_kind_of_music_helps_you_get_into_deep_focus/,2025-12-18,honeymustrd,"other than lofi, my favorites are:

thunder storm

creaky wooden ship in a storm

train ride during a blizzard

vaporwave (favorite channels are Astral Throb and Odysseus)",other than lofi my favorites are thunder storm creaky wooden ship in a storm train ride during a blizzard vaporwave favorite channels are astral throb and odysseus,,,Headspace Focus Music,5
c012-16,p012,comment,r/Productivity,https://www.reddit.com/r/productivity/comments/1pp6jse/what_kind_of_music_helps_you_get_into_deep_focus/,2025-12-18,alisonsparks98,"Something that's super familiar to me and that I've listened to like a million times. That way, I can even put a song with lyrics in the background, and my mind won't get distracted because the song is already familiar. I guess familiarity is comforting to me.",something that s super familiar to me and that i ve listened to like a million times that way i can even put a song with lyrics in the background and my mind won t get distracted because the song is already familiar i guess familiarity is comforting to me,,,Headspace Focus Music,1
c012-17,p012,comment,r/Productivity,https://www.reddit.com/r/productivity/comments/1pp6jse/what_kind_of_music_helps_you_get_into_deep_focus/,2025-12-18,Mysterious-Eggz,"jazz chill cafe and if it's holiday szn like this, christmas jazz chill café",jazz chill cafe and if it s holiday szn like this christmas jazz chill caf,,,Headspace Focus Music,1
c012-18,p012,comment,r/Productivity,https://www.reddit.com/r/productivity/comments/1pp6jse/what_kind_of_music_helps_you_get_into_deep_focus/,2025-12-18,WolfHaley7,"christmas jazz, but it has to be specific bc if it’s jazz that like is too much i lack concentration",christmas jazz but it has to be specific bc if it s jazz that like is too much i lack concentration,,,Headspace Focus Music,1
c012-19,p012,comment,r/Productivity,https://www.reddit.com/r/productivity/comments/1pp6jse/what_kind_of_music_helps_you_get_into_deep_focus/,2025-12-18,TheLadyTechnician,Nature soundscapes. That's all I listen now.,nature soundscapes that s all i listen now,,,Headspace Focus Music,6
c012-20,p012,comment,r/Productivity,https://www.reddit.com/r/productivity/comments/1pp6jse/what_kind_of_music_helps_you_get_into_deep_focus/,2025-12-18,HomeworkScary2919,"I’m on the same boat. Lo-fi is great, but the percussion can sometimes break my flow during complex debugging.

I actually went down the rabbit hole and built a 12-hour seamless 'Zen Ambient' loop for my own sessions. No beats, just consistent textures to mask the background noise. I’ve been running it as a 24/7 stream called FLOW STATE lately.

For me, the key is 'predictability' — if the music doesn't change its energy for hours, my brain just stops 'hearing' it and stays in the zone. Have you tried combining ambient with brown noise? It’s a game changer.",i m on the same boat lo fi is great but the percussion can sometimes break my flow during complex debugging i actually went down the rabbit hole and built a hour seamless zen ambient loop for my own sessions no beats just consistent textures to mask the background noise i ve been running it as a stream called flow state lately for me the key is predictability if the music doesn t change its energy for hours my brain just stops hearing it and stays in the zone have you tried combining ambient with brown noise it s a game changer,,,Headspace Focus Music,4
c012-21,p012,comment,r/Productivity,https://www.reddit.com/r/productivity/comments/1pp6jse/what_kind_of_music_helps_you_get_into_deep_focus/,2025-12-18,Garoto_do_programa,Math rock,math rock,,,Headspace Focus Music,7
p013,p013,post,r/AnnieClark,https://www.reddit.com/r/AnnieClark/comments/1kpa0lb/started_using_headspace_app_last_couple_days_and/,2025-05-18,javierglz,"Started using Headspace app last couple days. And to my surprise, there's a St. Vincent curated playlist of focus music. It's quite good! Very atmospheric, very relaxing. I only wish the was a way to see the names of the tracks and artists.",started using headspace app last couple days and to my surprise there s a st vincent curated playlist of focus music it s quite good very atmospheric very relaxing i only wish the was a way to see the names of the tracks and artists,,,Headspace Focus Music,2
c013-01,p013,comment,r/AnnieClark,https://www.reddit.com/r/AnnieClark/comments/1kpa0lb/started_using_headspace_app_last_couple_days_and/,2025-05-18,Internal-Owl3882,I am pretty focused from It,i am pretty focused from it,,,Headspace Focus Music,4
p014,p014,post,r/Meditation,https://www.reddit.com/r/Meditation/comments/1hm71wh/overwhelmed_as_a_beginner_how_do_you_use/,2024-12-25,Key_Awareness_5818,"Overwhelmed as a Beginner: How Do You Use Headspace to Manage Anxiety, ADHD, and Focus?
Question ❓
Hi everyone,

I’ve just started my meditation journey and decided to try out Headspace. While I’ve heard great things about it, I’m honestly feeling overwhelmed by the sheer amount of content. It feels like everything is scattered, and I’m not sure where to begin or how to make sense of it all.

Here’s what I’m trying to achieve:

Manage my anxiety with mindfulness.

Build focus and clarity (I have ADHD).

Calm my thoughts and develop a steady meditation habit.

For those who’ve been in my shoes:

How did you get started with Headspace or similar apps?

Are there specific courses, techniques, or routines you’d recommend?

How do you stay consistent and track progress without getting overwhelmed?

I’d really appreciate your advice or tips on making mindfulness stick, especially if you’ve struggled with focus or anxiety like I do.

Thanks in advance! Your insights could make a big difference for me and other beginners here. ",overwhelmed as a beginner how do you use headspace to manage anxiety adhd and focus question hi everyone i ve just started my meditation journey and decided to try out headspace while i ve heard great things about it i m honestly feeling overwhelmed by the sheer amount of content it feels like everything is scattered and i m not sure where to begin or how to make sense of it all here s what i m trying to achieve manage my anxiety with mindfulness build focus and clarity i have adhd calm my thoughts and develop a steady meditation habit for those who ve been in my shoes how did you get started with headspace or similar apps are there specific courses techniques or routines you d recommend how do you stay consistent and track progress without getting overwhelmed i d really appreciate your advice or tips on making mindfulness stick especially if you ve struggled with focus or anxiety like i do thanks in advance your insights could make a big difference for me and other beginners here,,,Headspace Focus Music,0
c014-01,p014,comment,r/Meditation,https://www.reddit.com/r/Meditation/comments/1hm71wh/overwhelmed_as_a_beginner_how_do_you_use/,2024-12-25,Ola_mundo,"Are you married to Headspace? It's sort of the McDonalds of meditation apps imo. Really popular, but lacking nutrition.

I also have ADHD and anxiety and what you need isn't some simple breath mediations, though those are a great starting point. What you really need is a way to organize the mess that is your inner life, at least that's what it felt like for me. For that goal, nothing is better than Waking Up. They have an actual intro course that teaches you things. The Headspace intro program is the same meditation repeated 30x. It's insane how that passes for a course.",are you married to headspace it s sort of the mcdonalds of meditation apps imo really popular but lacking nutrition i also have adhd and anxiety and what you need isn t some simple breath mediations though those are a great starting point what you really need is a way to organize the mess that is your inner life at least that s what it felt like for me for that goal nothing is better than waking up they have an actual intro course that teaches you things the headspace intro program is the same meditation repeated x it s insane how that passes for a course,,,Headspace Focus Music,0
c014-02,p014,comment,r/Meditation,https://www.reddit.com/r/Meditation/comments/1hm71wh/overwhelmed_as_a_beginner_how_do_you_use/,2024-12-26,heardWorse,"Fellow ADHD’er. Headspace is nice for relaxation (which is not to be underrated!) but unlikely to be of much help in building clarity and focus, which is what we tend to need so badly. 

Someone else mentioned Sam Harris’s app, which is much better than much else in the way of apps. He will actually explain to you what you are doing and what you are doing. He teaches a practice called Vipassana. I personally prefer zazen for its simplicity. Sit. Inhale. Count 10 breaths. Watch the experience of breathing as closed as you can. If your attention strays, that’s ok - just come back to your breathing and let the thought go. If you forget the count, that’s ok. Start over at one. It’s literally practicing redirecting your attention to where it’s supposed to be.

This may not be a popular opinion, but I would seek medication if you don’t have it already. I could not make meditation a habit, or deep without it.",fellow adhd er headspace is nice for relaxation which is not to be underrated but unlikely to be of much help in building clarity and focus which is what we tend to need so badly someone else mentioned sam harris s app which is much better than much else in the way of apps he will actually explain to you what you are doing and what you are doing he teaches a practice called vipassana i personally prefer zazen for its simplicity sit inhale count breaths watch the experience of breathing as closed as you can if your attention strays that s ok just come back to your breathing and let the thought go if you forget the count that s ok start over at one it s literally practicing redirecting your attention to where it s supposed to be this may not be a popular opinion but i would seek medication if you don t have it already i could not make meditation a habit or deep without it,,,Headspace Focus Music,0
c014-03,p014,comment,r/Meditation,https://www.reddit.com/r/Meditation/comments/1hm71wh/overwhelmed_as_a_beginner_how_do_you_use/,2024-12-25,Serious_Finger6205,"Headspace didn’t work for me, honestly. If you’re looking to improve focus, I highly recommend the book (or audiobook) “The Attention Revolution”. Meditating first thing in the morning really helps with focus too. You’ll also want to cut back on distractions like endless scrolling, as they can negatively impact concentration.",headspace didn t work for me honestly if you re looking to improve focus i highly recommend the book or audiobook the attention revolution meditating first thing in the morning really helps with focus too you ll also want to cut back on distractions like endless scrolling as they can negatively impact concentration,,,Headspace Focus Music,0
p015,p015,post,r/EngineeringStudents,https://www.reddit.com/r/EngineeringStudents/comments/1c192f0/what_music_helps_you_study_and_focus/,2024-04-11,Willing-Historian290,"What music helps you study and focus?
Academic Advice
I'm curious to know what type of music you guys listen to when you study. Recently, I discovered Study Sonic Focus binaural beats, which really help me get my brain into gear, but sometimes I feel like the music is too relaxing, and I need something a little more upbeat. Don't get me wrong, I love the chill vibes, and they've really helped me avoid distractions.

I'm curious to know what you all listen to. Do you prefer chill ambient music or something a bit more fast-paced? If you have any recommendations, please let me know!",what music helps you study and focus academic advice i m curious to know what type of music you guys listen to when you study recently i discovered study sonic focus binaural beats which really help me get my brain into gear but sometimes i feel like the music is too relaxing and i need something a little more upbeat don t get me wrong i love the chill vibes and they ve really helped me avoid distractions i m curious to know what you all listen to do you prefer chill ambient music or something a bit more fast paced if you have any recommendations please let me know,,,focus music,6
c015-01,p015,comment,r/EngineeringStudents,https://www.reddit.com/r/EngineeringStudents/comments/1c192f0/what_music_helps_you_study_and_focus/,2024-04-11,deleted user,Something not too complex or made to be a spectacle (which is why I never understand how people can study to classical lmfao. Though I love Claude DeBussy and Frederich Chopin). I go for calm piano jazz or lofi.,something not too complex or made to be a spectacle which is why i never understand how people can study to classical lmfao though i love claude debussy and frederich chopin i go for calm piano jazz or lofi,,,focus music,5
c015-02,p015,comment,r/EngineeringStudents,https://www.reddit.com/r/EngineeringStudents/comments/1c192f0/what_music_helps_you_study_and_focus/,2024-04-11,pinkphiloyd,"I have no idea how people can listen to music or television while they study. I need either dead, complete, absolute silence or, preferably, white noise that drowns anything else out.

I have a friend that studies in her car with the radio cranked. Whatever works for you, but it’s just incomprehensible to me that anyone could concentrate under those conditions.",i have no idea how people can listen to music or television while they study i need either dead complete absolute silence or preferably white noise that drowns anything else out i have a friend that studies in her car with the radio cranked whatever works for you but it s just incomprehensible to me that anyone could concentrate under those conditions,,,focus music,6
c015-03,p015,comment,r/EngineeringStudents,https://www.reddit.com/r/EngineeringStudents/comments/1c192f0/what_music_helps_you_study_and_focus/,2024-04-11,Willing-Historian290,"I can rarely find complete silence! I cant study in my dorm as I find working in my bedroom depressing! I will maybe give white noise a go though. Maybe you should try binaural beats to help you out, you might find it useful.",i can rarely find complete silence i cant study in my dorm as i find working in my bedroom depressing i will maybe give white noise a go though maybe you should try binaural beats to help you out you might find it useful,,,focus music,6
c015-04,p015,comment,r/EngineeringStudents,https://www.reddit.com/r/EngineeringStudents/comments/1c192f0/what_music_helps_you_study_and_focus/,2024-04-11,Teddy547,"I listen to videogame soundtracks I like. Also some film music. Purely instrumental stuff, otherwise I get distracted by it.",i listen to videogame soundtracks i like also some film music purely instrumental stuff otherwise i get distracted by it,,,focus music,7
c015-05,p015,comment,r/EngineeringStudents,https://www.reddit.com/r/EngineeringStudents/comments/1c192f0/what_music_helps_you_study_and_focus/,2024-04-11,Agitated-Rope-4302,I like to listen to like Legend of Zelda Lofi.,i like to listen to like legend of zelda lofi,,,focus music,5
c015-06,p015,comment,r/EngineeringStudents,https://www.reddit.com/r/EngineeringStudents/comments/1c192f0/what_music_helps_you_study_and_focus/,2024-04-11,Polaristical,Stardew Valley Playlist by ConcernedApe,stardew valley playlist by concernedape,,,focus music,1
c015-07,p015,comment,r/EngineeringStudents,https://www.reddit.com/r/EngineeringStudents/comments/1c192f0/what_music_helps_you_study_and_focus/,2024-04-11,deleted user,"Literally every good music you like

Coming from an ADHDer that can’t study without music on & I listen to all kinds of music frankly and it’s working!",literally every good music you like coming from an adhder that can t study without music on i listen to all kinds of music frankly and it s working,,,focus music,6
c015-08,p015,comment,r/EngineeringStudents,https://www.reddit.com/r/EngineeringStudents/comments/1c192f0/what_music_helps_you_study_and_focus/,2024-04-11,papixsupreme12,"Wave music, hardcore dubstep, trance, EDM etc. basically anything to drown out the voices in my head",wave music hardcore dubstep trance edm etc basically anything to drown out the voices in my head,,,focus music,2
c015-09,p015,comment,r/EngineeringStudents,https://www.reddit.com/r/EngineeringStudents/comments/1c192f0/what_music_helps_you_study_and_focus/,2024-04-11,MuffinKingStudios,"Definitely use the electronic trance music when I need to buckle down. Classic rock and blues instrumentals work slight less well.

Pretty much anything with lyrics or words in it distracts",definitely use the electronic trance music when i need to buckle down classic rock and blues instrumentals work slight less well pretty much anything with lyrics or words in it distracts,,,focus music,4
c015-10,p015,comment,r/EngineeringStudents,https://www.reddit.com/r/EngineeringStudents/comments/1c192f0/what_music_helps_you_study_and_focus/,2024-04-11,clutchengaged84,I like to have king of the hill or adventure time playing in the background. I’m 40 lol,i like to have king of the hill or adventure time playing in the background i m lol,,,focus music,1
c015-11,p015,comment,r/EngineeringStudents,https://www.reddit.com/r/EngineeringStudents/comments/1c192f0/what_music_helps_you_study_and_focus/,2024-04-11,Diabolical_Laughter7,J-Pop or Death Metal,j pop or death metal,,,focus music,1
c015-12,p015,comment,r/EngineeringStudents,https://www.reddit.com/r/EngineeringStudents/comments/1c192f0/what_music_helps_you_study_and_focus/,2024-04-11,Someguy242blue,Nujabes,nujabes,,,focus music,1
c015-13,p015,comment,r/EngineeringStudents,https://www.reddit.com/r/EngineeringStudents/comments/1c192f0/what_music_helps_you_study_and_focus/,2024-04-11,CharmingCar813,"to start i listen to frequencies. it does something to ease my ADHD mind, during, i really do enjoy spanish salsa music, because of the rhythm and i don’t know spanish, so it’s easy to tune it out.",to start i listen to frequencies it does something to ease my adhd mind during i really do enjoy spanish salsa music because of the rhythm and i don t know spanish so it s easy to tune it out,,,focus music,7
c015-14,p015,comment,r/EngineeringStudents,https://www.reddit.com/r/EngineeringStudents/comments/1c192f0/what_music_helps_you_study_and_focus/,2024-04-11,United-Confection697,"Oppenheimer sound track. Don’t knock it till you try it. Helped me grind out a whole Rankine Cycle lab report in one sitting.

Edit: There’s no words, so I find that really really helps me think clear while also having some tunes blast through my ear drums.",oppenheimer sound track don t knock it till you try it helped me grind out a whole rankine cycle lab report in one sitting edit there s no words so i find that really really helps me think clear while also having some tunes blast through my ear drums,,,focus music,6
c015-15,p015,comment,r/EngineeringStudents,https://www.reddit.com/r/EngineeringStudents/comments/1c192f0/what_music_helps_you_study_and_focus/,2024-04-11,caty0325,"I listen to loud hip hop radio or video game OSTs, depending on what I’m in the mood for.",i listen to loud hip hop radio or video game osts depending on what i m in the mood for,,,focus music,6
c015-16,p015,comment,r/EngineeringStudents,https://www.reddit.com/r/EngineeringStudents/comments/1c192f0/what_music_helps_you_study_and_focus/,2024-04-11,MeatSuitRiot,Classical guitar or acapella,classical guitar or acapella,,,focus music,7
